{"authority":"non-authoritative-reviewed-static-control-data","directional_binding":"control-revision-g-describes-earlier-implementation-revision-h","implementation":{"revision":"33314a9999cbe1e0eb927ba4a1e6f1ee10fcd5df","selected_sources":[{"path":"deploy/aws-feasibility/remote/completion_guest_workloads_v2.py","sha256":"723bf54ef1b9b1fe4670b1a0d82e6744a29d33fbd0dc2cad4b3cc88863dae406","size":33332},{"path":"deploy/aws-feasibility/remote/completion_guest_workloads_v3.py","sha256":"1d94ba3a17a8b76a3b326359d89a140f0d02c4c8341d61fb94fff5cd98ccd2db","size":27315},{"path":"deploy/aws-feasibility/remote/completion_kata_actions.py","sha256":"3af89a7833b53d6952dbbfd755d739a9d85d55243b7b2e888c87f8c314dd5d0a","size":4338},{"path":"deploy/aws-feasibility/remote/completion_kata_admission.py","sha256":"52dc639bc763660fe806b0c47c4310c85ae45987382b5d1a6874dbd6379b140a","size":44424},{"path":"deploy/aws-feasibility/remote/completion_kata_command_policy.py","sha256":"aa8995cd5e2cb50b22149965982227052a1a04125ba114359adca3b2a751be2e","size":16417},{"path":"deploy/aws-feasibility/remote/completion_kata_coordinator.py","sha256":"6358e518e9a44a35c05fe8d44c8cb6bf5f376cea48f08879efc7b5a35d3fc82e","size":21521},{"path":"deploy/aws-feasibility/remote/completion_kata_execution_bridge.py","sha256":"40343b53faa6326e51b8216fbde873012a6a6473f46ce5387b936b8d5158e6e6","size":26653},{"path":"deploy/aws-feasibility/remote/completion_kata_fdmap.py","sha256":"dc50344f756725dd8904c0d849b6299742c26bb0d88731370c991ce2a38444df","size":13187},{"path":"deploy/aws-feasibility/remote/completion_kata_immutable_preparation.py","sha256":"cf1757832fdfd443dcb8265c32dec68e7a7e7c4d3c28e4246f00c27120a554c9","size":33820},{"path":"deploy/aws-feasibility/remote/completion_kata_inputs.py","sha256":"1da8e33c13f11ca7894e9f9f48f7e91036a38d339c5f621acb7777d24dd3f310","size":108504},{"path":"deploy/aws-feasibility/remote/completion_kata_network.py","sha256":"e422a1254a279e822a97ae657b7441360d266bb1b572210893bce48723dee57f","size":183343},{"path":"deploy/aws-feasibility/remote/completion_kata_network_journal.py","sha256":"c7f1da06cd75cc57bebee38a4b64c182f21e7b55bad8fbe9abad3697be0ca334","size":44559},{"path":"deploy/aws-feasibility/remote/completion_kata_nft_owner.py","sha256":"ee43d5f1cb35790de7d542a853d8f2772e078f9b287e97ed0b8affd6342a7105","size":36036},{"path":"deploy/aws-feasibility/remote/completion_kata_operation.py","sha256":"c77de3456c4e054e767bd72e8c6dd52d01148d1dca3021f44bac8a81434487d6","size":171657},{"path":"deploy/aws-feasibility/remote/completion_kata_operation_bridge.py","sha256":"0d0054ae1905001382e0107d0f840deb57c3c1c574826da5af45ab84536e5052","size":12951},{"path":"deploy/aws-feasibility/remote/completion_kata_preparation.py","sha256":"90e89c246645c871e03251ac8dc18656962227e39aac1ad3df546846741d7592","size":63192},{"path":"deploy/aws-feasibility/remote/completion_kata_preparation_bridge.py","sha256":"83cb656b88102fea0473c1699c67b1248fcd9ddb5fdab24f51adcd074e3d6fe1","size":7922},{"path":"deploy/aws-feasibility/remote/completion_kata_process.py","sha256":"21c642d0689b4a3818e312fbbddee96bc242b72fc3c2be9be4e7bbfe8f4bf625","size":106538},{"path":"deploy/aws-feasibility/remote/completion_kata_runtime.py","sha256":"6520afa590193a4c376b4451b9a5c062cec6998d460cef261aa55ac684c4484c","size":104232},{"path":"deploy/aws-feasibility/remote/completion_kata_ssh.py","sha256":"c8183aa15c01c78a6222998551aec05ff75089d2403a15e98a055872cbd4515f","size":15809},{"path":"deploy/aws-feasibility/remote/completion_local_evidence.py","sha256":"541eaf24576fb4c3c89fd3725ff029efc40aca6c6bec285521f5c0f61f5e760b","size":41462},{"path":"deploy/aws-feasibility/remote/completion_local_full.py","sha256":"262b2fb9c20f163d36e422f01dc7fa1c7285c0fb1505e416cdbf0826a656bc50","size":16908},{"path":"deploy/aws-feasibility/remote/completion_local_receipt.py","sha256":"55a0adf73900f8d53a588db8eb661303d6b9f7afbf9b58151382e72406643583","size":4208},{"path":"deploy/aws-feasibility/remote/completion_rootfs_fs.py","sha256":"aa263f3d0868f5f953f4a65c0c34d9a4cc59223fb35e25436cb195b34f9edb16","size":37179},{"path":"deploy/aws-feasibility/remote/completion_rootfs_lease.py","sha256":"be156a478096237587a15fbae10b4972bdbc0b74740f5b4fae775896391a5327","size":35265},{"path":"deploy/aws-feasibility/remote/completion_rootfs_plan.py","sha256":"4393424b978bf3ba1fa72a14b5a7a32d60c93891d3f137310d61c4dc8b256dfb","size":22433},{"path":"deploy/aws-feasibility/remote/completion_runtime_closure.py","sha256":"87b0364c412c3e28def161e81a81c3c5be17ddbf44f947403651131e1d101912","size":11103},{"path":"deploy/aws-feasibility/remote/completion_runtime_contract.py","sha256":"3ed164fbdc0630c944b9f79a03c109080f3fbeb7d846ee6e83a4ebe7f22404af","size":31579},{"path":"deploy/aws-feasibility/remote/recover-stage2-completion-remote.sh","sha256":"0683d19686617969e3a19fc83251016c9fa9d0f865d2c05ba1094ebb71a93d1f","size":1064},{"path":"schemas/stage2-local-execution-envelope-v2.json","sha256":"fa93b79dfdd6bd061b68bb738d97b6f2682a52923c938235df9d655961fac828","size":6523},{"path":"schemas/stage2-local-runtime-manifest-v2.json","sha256":"b9401a99c0f2028bdf9e3a29f9a4ce6ddd598650270402557ef79d5ec527c727","size":10990},{"path":"schemas/stage2-local-static-control-package-v1.json","sha256":"7de5b4ad7076bb2be07d448852e37ffcfec256d1dda40d84a9077d6f0da82bf0","size":3659}],"selected_sources_sha256":"3a12f2b2abac04fea92c5483595e7572da53402ecf05632e5283fa0ef18d97da","source_manifest_sha256":"237061a74a38ea9355fc25c5bebae91d683327d4d36db2acf33da13d7ba8c5fe"},"members":[{"kind":"executable-closure","name":"contracts/00-ip.json","sha256":"6648463f0d7c43d4ebcdf00502252e9a33b25539f7832d09a16fd65879540656","size":2304},{"kind":"executable-closure","name":"contracts/01-tc.json","sha256":"87f66740e65a1654f8769d6b8b7d19aa0051cca969e6fb1c6f134d6ac910df1f","size":2797},{"kind":"executable-closure","name":"contracts/02-nft.json","sha256":"9a94e9f12137f042324241e950f985690bc195871546849b6ffc1ed1a7fcabf5","size":3255},{"kind":"executable-closure","name":"contracts/03-ssh.json","sha256":"b57cf54354f858ed09b7cd18ba39d4177b25b1a32677aba0e4beb4f6fd6bd58e","size":3669},{"kind":"executable-closure","name":"contracts/04-ssh-keygen.json","sha256":"06c199c48b759db3abbf7ae18874d7ce888f2e244a467855c3bf308ff64270ec","size":1646},{"kind":"executable-closure","name":"contracts/05-containerd.json","sha256":"0e38431657498d6a681cff0959af4ba25e1296788d92821b8403929f6ea85a2e","size":623},{"kind":"executable-closure","name":"contracts/06-ctr.json","sha256":"252d9875fac696c617c1ec4085955f2d66e17d6361fbfef70473ab0f2f901379","size":602},{"kind":"executable-closure","name":"contracts/07-shim.json","sha256":"17184a3f825a1175b7fdf0d31864f41ce9b8e7557116c4d08dec042ba292ec10","size":928},{"kind":"executable-closure","name":"contracts/08-qemu.json","sha256":"d18bf79136d001249a1e51b0ebc1e1ba79302237bdc8f561db232ba230334584","size":449},{"kind":"executable-closure","name":"contracts/09-virtiofsd.json","sha256":"b3b1184c71028f3ea45c7753e5604adef0dbb6b8b1d6b56753809014afee6bd0","size":443},{"kind":"envelope","name":"stage2-local-execution-envelope-v2.json","sha256":"70c26c49aa1801e31edd01cde8eee37f72a9577fd538e1a75a3de99b95e4a870","size":8030},{"kind":"runtime-manifest","name":"stage2-local-runtime-manifest-v2.json","sha256":"ca120ffffb8b76d37afedaa74688bab42e5fb2c20c1e1711e5a175c043ce6e02","size":130893}],"producer":{"classification":"deterministic-no-kvm-static-observation-candidate","forbidden_surfaces":["containerd","coordinator","kata","kvm","qmp","ssh","task"],"implementation_revision":"33314a9999cbe1e0eb927ba4a1e6f1ee10fcd5df","kvm_absent":true,"network_used":false,"source_manifest_sha256":"237061a74a38ea9355fc25c5bebae91d683327d4d36db2acf33da13d7ba8c5fe"},"version":"cogs.stage2-local-static-control-package/v1"}
